东方可乐,5.0,2019-3-18 13:33:33,有点楚留香传奇的感觉，你妈的，整部片子瞎几把扯，最后说都是刘青云设计好的，编剧有病吧
西西里的瓦力,5.0,2019-1-10 16:58:08,故事讲到哪儿，拍到哪儿。有一个梁朝伟吊威亚穿帮镜头。
YUKI-Dong,8.1,2019-1-3 8:51:51,出来混，迟早要挂的。。。
寒武,8.0,2018-12-24 1:02:43,可惜了，这么好的电影才看到，之前一直有点拒绝。缺点是故事讲的好匆忙，很多地方可以停一停，表现的更细腻点，会是经典。
热血地狱,7.0,2018-10-26 21:11:03,这片神奇.........
随风819,7.0,2018-8-28 5:56:50,看的有点忘了
雷天鸣,6.4,2018-5-8 16:16:09,可以一看
我在远方,10,2018-5-6 0:11:02,几乎完美的片子，感觉刘青云没死，故意让梁朝伟当替死鬼。
頭面人物,7.4,2018-3-25 16:50:00,在遥远的1998年，可以算是类型片的先锋之作了。牢房粉尘里的对决，结尾的镜子厂大战都非常的银河，幕后老手掌控全局的设定也非常宿命。几个人物生的苟且死的随意，还是让一场黑帮肃清大戏格局小了很多。伟仔和黑仔当年嫩的出水啊，让角色都有种刻意扮狠的错觉了。
格子810189,8.2,2018-1-16 13:49:03,关于港澳黑帮片的巅峰类作品，Cult血腥场面十足！ ​​​​
忘穿裤衩,8.0,2017-12-30 9:11:10,很好的故事
touya,8.1,2017-10-20 16:18:34,银河初期的作品还是很妖冶，虚实交错，相互算计，最终都算不过宿命。当然太“一切尽在掌握”的设定也让故事有点飘，风格倒是立的很稳。刘青云这光头形象真是气场太邪了，那个时候好演员搁在一起演戏就是能火花四溅。
寂寥一生,8.4,2017-8-28 17:11:56,宿命！黑暗！梁朝伟，刘青云真心演技爆棚！
梦之峰,7.0,2017-8-15 21:50:57,表达的什么啊
不羁de天空,7.8,2017-7-28 23:27:02,十几年没回过澳门的老东西，就是这么厉害！
社上君,,2017-6-21 20:28:04,在华语电影界，很出色的悬疑。但是，什么命运之类命题的说法，本人却不怎么感冒。
司小幽,9.4,2017-5-12 12:52:14,双影帝飚戏，全程无尿点，音乐超赞，场景别致~尤其是最后镜子对决！！！
四条棍744254,8.0,2017-3-30 14:40:52,短小精干，浓缩的都是精华
Homkee,7.0,2017-3-16 23:00:38,个别配乐还是蛮出彩，但是太多反而容易疲劳。情节紧凑却略显拖沓。任人摆布真不是个滋味。
衰仔乐园,8.5,2017-1-24 20:59:43,很悬疑。故事背景其实很简单，但是情节发展却很紧凑和悬疑啊。
小溪1981,9.0,2016-12-30 15:50:59,完美的银河电影。演技和情节真的很完美
水·无痕,7.0,2016-12-9 8:36:21,刘青云眼神阴鸷，梁朝伟混迹两道，很聪明的年轻人，却都是别人手中的弹球，运动轨迹不由自己控制
百家影评,6.0,2016-12-3 13:33:29,多年前看过如今已无印象，属于看完就忘记讲什么的平庸电影
JAY2090769,8.1,2016-11-29 20:10:15,这部暗花完全超出我的预期，故事设计的相当紧凑，只是最后的镜子枪战实在拖沓，着墨过多，另外就是一些地方存在取巧。不过已经拍得很有意思了，最后王天林的做人不要聪明过头实在点题，因为过了头总会有意想不到的事发生，应了那句话：最屌的都是背后的人。
影神,8.0,2016-11-6 23:41:09,黑色，冷酷，暴力，银河映像风格初成型
荫木,,2016-10-21 23:10:27,很喜欢这一部。梁朝伟展现出了从没见过的一面。
安菲尔德,7.5,2016-10-16 22:49:05,这个局有够狠，同情梁朝伟，不过没查看刘青云的包是啥有点扯。。。
lee原名被抢,7.5,2016-10-16 22:48:52,银河出品，必属精品，但是远没有达到应有的高度，浪费了一个好故事，尤其是背景音乐长时间滥用及宏大旋律的滥用，还有最后的对决中的镜子，都是硬伤。。
掉色的彩虹,9.0,2016-10-5 22:35:03,深深的套路和宿命。
118号元素,8.0,2016-10-2 20:43:39,"非常不错,结尾稍稍差点,前60分钟的剧情安排非常好"
飘舞秦,7.0,2016-9-29 4:42:27,年轻的时候看电影选题材 此类型在女孩眼中属于烂片系 现在重看 感觉完全不一样 看的点不同 美女是比较知道啥是美 电影也如此 当年看电影 觉得这水准很普通 对比近些年面上的影片 才知道90年代这些平平制作甩现在脑残片几条银河系
大羽王者,8.0,2016-9-4 17:58:45,银河映像所有电影里我最喜欢的一部了（超过枪火、黑社会，暗战），我看了好多遍。黑、酷、冷的黑色电影风格发挥到极致，故事曲折翻转无懈可击，人物内心复杂多变梁朝伟表演尤其精彩，这估计是梁朝伟平生演技代表作之一了。而且要注意到这部电影的导演是游达志，监制才是杜琪峰，游达志早已经离开银河映像 ，银河映像也有点不复当年之用，感慨。
Celen,7.9,2016-8-6 21:16:14,重温一遍，感觉真好。伟仔被市民刘先生从头“套”到尾的故事。其实背后智多星应该是王晶的肥仔老爹么...
realhwq,8.2,2016-8-6 10:44:35,本片是类型杂糅的绝佳范本：警匪片的轴、黑帮片的魂，高潮段落是西部片的形式和《变脸》的致敬；更令人惊喜的是，落入漩涡&身份替换的警匪关系设计、无处逃遁的结尾和主题，简直就是《无间道》的雏形。导演将暴力元素发挥到了极致，不断翻新暴力手段，感官极为刺激；但黑色电影的灯光、高潮场景的镜像，悬疑气氛、西部片的仪式感又都控制得极好，让动作场面也颇具诗意。惊喜之作！
银月之魂,7.0,2016-7-29 21:39:14,很不错的脑洞体验
AndyZJ,7.5,2016-7-18 10:34:01,经典港片的赶脚呼之欲出，带点古惑仔的暴戾和计中计的谋略，完美诠释了什么叫“螳螂捕蝉，黄雀在后”，节奏控制地还算不错，中段前的铺垫到之后的那段港口戏过渡地很自然，不露痕迹，最后的枪战虽然和之后的《神探》神似，不过那个直接剁头有被惊到。结局大赞。梁朝伟表现比刘青云出色。
mmyyymm,8.8,2016-7-6 23:34:46,所有人都是洪先生的棋子。。这一环扣一环的计谋实在好看，镜子间对决稍拖沓
海贼王路飞,8.0,2016-6-16 2:24:44,澳门大哥们被一个老掉牙的老江湖玩弄灭帮的故事。。。 刘青云的提包里一开始就装了基哥的头了吧？我不理解的是为什么伟仔一开始就看他不顺眼赶他走还让他丢下包却根本不关心包里装的有什么呢？如果从一开始他就发现这个包里的人头，洪先生的整个计划还能顺利进行下去吗？ 一个包被扔在地上这么久没人捡或是打开看看我还可以理解为这个包可能有专人看管，但对待其他人都这么狠的伟仔居然不搜自己一眼就看出是杀手的刘青云的包还刻意放他走是何用意？
独自哥哥,8.0,2016-5-22 15:10:59,http://murl.tv/grC1
perfect当,9.0,2016-5-18 21:02:37,……厉害。容我压压惊。这电影放到现在的影院。碾压无疑。
大梦一场的umaso小姐,8.0,2016-5-18 16:26:55,套路好深啊
无人用电锯,8.0,2016-5-17 11:37:57,两位男主角都是超喜欢的演员。
Samantha113,8.0,2016-5-7 22:12:41,我懂导演想要表达出宿命的感觉，但这死法真是令人掀桌
filmman,7.5,2016-4-25 21:14:16,结局唏嘘，每个人都认为自己很聪明，却没想到螳螂捕蝉黄雀在后，不过是一个棋子。
念及己名,8.0,2016-4-25 16:04:22,暗处之花，芳尽长夜。
skyblue107272,8.0,2016-4-22 0:20:00,隔了这么多年在大屏幕上看，一点没有觉得黑暗能少一点，真是暗无天日到无路可走。
火麒麟ST,7.9,2016-4-19 21:38:11,即使在一贯特立独行的银河映像的作品中，它也显得十分独特。最暗的夜，最明亮的刀刃
血奴鹦鹉,8.0,2016-4-19 17:28:59,《暗花》就是一部令人惊艳的电影。电影一开始就告诉所有观众：“暗花”的意思是指黑社会暗底下为杀一个人所出的价码，这部电影所讲述故事发生在澳门，是一个关于黑帮间利益仇杀的故事，而且整个故事并不长，不过区区10小时间。一切准备就绪，观众们似乎只需坐等影片结局的火拼就足够了。与所有银河映像的电影一样，只有一个结局是远远不足以满足游达志的野心的
Jim·k,8.0,2016-4-17 0:15:42,BGM果断好评！梁朝伟VS刘青云，两大影帝的巅峰对决，最后谁也没活下来...邵美琪里面印象挺深的，一直在那吐啊叫的...
很简单的哎,8.0,2016-4-14 22:48:39,很有味道，仿佛一个人分裂成两个，彼此对立而又统一。
绯色_神仙,7.0,2016-4-12 20:03:17,恩，精妙的陷害计划，不过感觉镜头好抖，看起来不舒服。
tycoon,7.7,2016-4-5 21:09:56,在江湖老大面前，没有主角。另外，电影反其道而行之，通过维和讲内斗。
莈洧洳菓,8.1,2016-3-29 17:25:05,黑暗里最黑的花
海绵软绵绵,8.8,2016-3-18 22:17:27,剧本非常好！老香港的感觉很有，不过有点浮在表面上。然后那时候的梁朝伟刘青云都不够酷不够酷
古道朝阳,9.0,2016-3-14 20:39:47,银河映像早期的作品真好！出类拔萃的剧本；梁朝伟、刘青云两大影帝玩对手戏酣畅淋漓；全片挥之不去的绝望感，到最后倒下那一刻达到极致，陷入深沉的黑暗，永无尽头！！
mao---,7.0,2016-3-13 10:37:36,刘青云头撞碎挡风玻璃那一段神了
小草人七,8.3,2016-2-29 19:59:34,多次惊喜过后，终是难逃一死。
迷糊小麻雀,7.3,2016-2-20 19:00:20,剧情反转的挺厉害的。最后只能说：姜还是老的辣
楚翰彻,7.6,2016-2-18 15:47:08,与其说是一个腥风血雨的黑帮纷争，不如说本片讲述了命运的荒诞无常，以及一个已然被命运吞噬，却又在其中不断挣扎的疲惫灵魂。狂野不羁的刘青云自然足够吸引眼球，而梁朝伟却用颠覆性的表演支撑起整部电影的脉络与主题。但不可避免的，连同结尾画蛇添足的枪战成为本片的硬伤，不如几处伏笔来的精妙。
神的孩子都舞蹈,8.7,2016-1-27 19:52:23,这是一部典型的香港片，更是一部典型的银河映像的电影。有些像杜琪峰的感觉，但是又有一种更加奇妙的感觉。这部电影不难理解，感觉像枪火一气呵成。刘青云与梁朝伟有这俩影帝绝对好看。这又是一部不得不看的港片！！！
神的孩子都舞蹈,8.7,2016-1-27 19:51:46,这是一部典型的香港片，更是一部典型的银河映像的电影。有些像杜琪峰的感觉，但是又有一种更加奇妙的感觉。这部电影不难理解，感觉像枪火一气呵成。刘青云与梁朝伟有这俩影帝绝对好看。这又是一部不得不看的港片！！！
机机歪歪,7.0,2016-1-15 17:44:58,看不懂哦，还要百度剧情解析~~
spike1623990,7.8,2016-1-8 13:17:57,一部好片子！
·DHW·,8.0,2015-12-30 2:45:51,挺好看，导演，演员都到位了。
AWC奧奧,7.1,2015-12-18 7:34:16,千万不要瞧不起老年人
·虫虐·,7.5,2015-12-9 17:08:25,典型的港产电影，又不太典型； 剧情上的铺陈很到位，有种紧凑的饱足感； 除了配乐有些雷人，其他都挺好的，最后ENDING假东哥被干掉也是蛮到位就是了～ ②-1.5S
韩景峰看电影,8.0,2015-11-18 15:50:48,这是银河映像标志性的警匪作品，镜头上多以黑暗的色调为主，同时搭配偏冷的氛围营造，故事上强调小人物命运在斗争大势中的微不足道，有很强烈的宿命论意识，但无论是游达志的《暗花》还是韦家辉的《一个字头的诞生》，虽然他们在镜头运用上都别具一格，但终究欠缺杜琪峰的那一份控制。
韩景峰看电影,8.0,2015-11-18 15:50:48,这是银河映像标志性的警匪作品，镜头上多以黑暗的色调为主，同时搭配偏冷的氛围营造，故事上强调小人物命运在斗争大势中的微不足道，有很强烈的宿命论意识，但无论是游达志的《暗花》还是韦家辉的《一个字头的诞生》，虽然他们在镜头运用上都别具一格，但终究欠缺杜琪峰的那一份控制。
韩景峰看电影,8.0,2015-11-18 15:49:50,这是银河映像标志性的警匪作品，镜头上多以黑暗的色调为主，同时搭配偏冷的氛围营造，故事上强调小人物命运在斗争大势中的微不足道，有很强烈的宿命论意识，但无论是游达志的《暗花》还是韦家辉的《一个字头的诞生》，虽然他们在镜头运用上都别具一格，但终究欠缺杜琪峰的那一份控制。
韩景峰看电影,8.0,2015-11-18 15:49:50,这是银河映像标志性的警匪作品，镜头上多以黑暗的色调为主，同时搭配偏冷的氛围营造，故事上强调小人物命运在斗争大势中的微不足道，有很强烈的宿命论意识，但无论是游达志的《暗花》还是韦家辉的《一个字头的诞生》，虽然他们在镜头运用上都别具一格，但终究欠缺杜琪峰的那一份控制。
纯洁的缺德梅,8.4,2015-8-4 21:41:12,8.3 短短一夜，却似最长一夜。古龙似的悬疑，不可思议的算计，江湖已是尔虞我诈，江湖人就如弹球，不知道往哪弹，何处停。暗花通片暗，所有无力，不安、恐惧都来自那不曾消失的险恶的白光。还有结尾的双雄枪战，镜子在幽暗中破碎成银色烟花。
小伟爱电影,8.0,2015-6-28 14:23:43,拍的酷酷的片子，感觉有点像杜琪峰的风格有木有？！
sj9202,9.0,2015-5-20 21:45:27,你值多少”暗花“？
Mr_Turquoise,8.1,2015-5-18 10:59:15,我想说的是时光你把精彩台词抄错了。。。。应该是“我不是个好警察，为什么选我？”
_且听_风吟,8.0,2015-5-10 22:46:25,伟仔和青云的演技好到没的说，片子还不错，就是给人一种匠心很重的感觉。
莱阳影评人,8.0,2015-5-9 17:08:38,刘青云的光头藏不了花
狗血又慌张,8.0,2015-4-27 1:10:09,杀人巧妙，本片独有的创意风格，不拖沓的切镜和发展都给人快狠准
醒也无聊,7.6,2015-4-19 16:22:03,影片的布局很巧妙，典型的银河映像作品，演员都很棒，就是不是太喜欢这种灰色情节。
yjxue84,8.6,2015-4-2 22:43:58,绝对是港片的经典之作！
伦夕,7.8,2015-3-5 19:15:06,影片在故事讲诉、镜头切换、背景音乐的选取上和《英雄本色》类的传统香港警匪片相比都焕然一新。但结尾前梁和刘的仿武侠片的枪战和整个政治场互斗的氛围不太协调。
OKBEN,,2015-1-25 18:50:42,劇情設計很贊.動作設計很渣
影迷瓦力,8.5,2015-1-19 20:24:49,短短时间内塞进了这么多悬疑，港片中的黑色经典。狱中灰尘里的对峙和结尾的镜子枪战都非常赞，游达志怎么不拍片了啊。
桑卡卡夫,8.0,2014-12-17 10:27:25,一开始不明白片名的意思，后来才知道是粤语中地下悬红之意。本片无论在叙事上对阴谋的宏大布局，还是在镜头语言和场面调度上的创意，都非常出色，算是银河映像的代表作之一。可惜游达志后来与杜、韦分道扬镳，铁三角缺其一，再也不完整了。
格斯范,7.2,2014-11-5 22:11:30,怎么努力，你也不会有好下场
狂热信羽,8.0,2014-10-23 23:12:07,一切尽在掌握。。。
自由彼岸,7.6,2014-10-22 22:23:27,感觉有个很好的创意，却草草结束、没有进行很好的发散的样子。片尾的镜子大战还是不错的。
瞎弄弄,7.3,2014-10-19 13:31:51,看刘青云剃了光头演坏人总觉得不习惯
樱木花城,7.6,2014-10-12 23:05:46,"片子有些""宿命论“的成分，刘青云饰演的杀手和梁朝伟饰演的黑白两道通吃的警察终究还是被当成提线木偶一样被吞没。片子比较精悍，代表了银河映像的初期风格，可以怀念。"
老牧,8.0,2014-10-9 14:57:28,老人家惹不起，人家不仅会下套，还会玩提线木偶。
纯洁之火,8.0,2014-10-5 23:44:57,香港电影 经典之作，彰显内部的勾心斗角与暗算，黑社会老大也不好当呀
家庭娱乐,10,2014-9-25 15:51:04,其实最后梁朝伟不能再走青云的逃跑路线了，都被整那么多次都不能再相信洪先生的了，算是这片唯一一个不够好的地方
余浩南,8.0,2014-9-24 23:28:47,东方好莱坞90年代末无杜琪峰，游乃海，司徒锦源，游达志既黑帮警匪片就失色不少。剧情对观众智慧控制十分好，悬念睇落去有豁然开朗既感觉。虽然依咖睇落并不高端的连环套，但系过程十分过瘾，系不少港片迷心中完美既双雄片。好多经典老梗，同将资源最大化讲好故事，依咖HK导演进内地都忘了。
蝙蝠俠,7.6,2014-9-9 21:20:49,编剧很好，从头到尾节奏把握也不错，主演表演也很好，经典的老港片。
靓坤lv0461,8.8,2014-9-9 20:08:50,经典中的经典，配乐强大，演员好，香港黑帮片代表作
LexusLiang,8.0,2014-8-19 23:09:59,姜还是老的辣啊~~这局设的好狠~~这两大主演怎么也想不到自己也是清场对象~~
香蕉个八辣,9.4,2014-6-24 22:11:10,怎么看梁朝伟都有点像 加里奥德曼
Cheeson,8.4,2014-6-19 9:36:38,局中局
刘战斗君,8.5,2014-5-24 11:29:01,你以为你把自己的命运捏在手里了，其实只是吃了上帝的一个假动作
熾之涅磐,,2014-5-22 12:42:20,#窃听游戏#银河粉自然推银河系的电影啦~《暗花》 ！开头的洪老头出来还让人莫名其妙，结尾同样的画面，同样的台词，同样的洪老头~足以令人恍然大悟！@人中之龙5599142 @arga1219 @普林斯顿 
本朝,8.4,2014-5-15 10:22:09,非常好看的经典，编剧用心啊。伟仔和刘青云简直在飚神演技了。看原片就是爽啊，放在现在很难有这么好看的警匪片了。
徐净园,9.0,2014-4-30 21:47:26,很棒，很香港。赞一个。
Yang_Young,,2014-4-17 22:01:50,我想说，原声太好听了！！！@Venus_in_Velvet 美错 @美丽心灵De永恒阳光   @StayWithMe @叛卡门 @复仇者猫头      。http://murl.tv/8PVz
复仇者猫头,8.0,2014-4-15 23:22:09,个人最喜欢的港片之一。可惜找不到原声
陈一,9.0,2014-4-8 20:55:58,聪明人与命运玩摔跤  结果？呵呵...
Steam·Punk,8.0,2014-4-5 16:42:04,http://murl.tv/8ILx
ArsenalHazard,8.0,2014-4-4 20:25:59,设的一手好局，经典港片！
小时光匆匆丶,7.0,2014-3-24 23:55:08,#分享图片#
猫的心情,10,2014-2-28 15:04:49,近乎完美的电影，简单原始粗暴直接，却正是人心里的漩涡
AndyTo1982,10,2014-2-11 23:20:18,堪称完美的银河作品！
M族1086598,,2014-1-12 13:31:08,好剧本！ps：大陆配音真是受够了！石斑鱼给梁朝伟配的音，不要这样吧，这不是喜剧片啊大哥
britboy,8.0,2014-1-6 0:28:13,全靠摄影和人物塑造拉分
Harrydor,8.0,2013-12-26 13:52:38,澳门的何先生。其实真正的黑社会可能比这里还黑，感觉刘青云演黑社会比梁朝伟更像，梁朝伟太像一个警察了
少丞先生,7.8,2013-12-24 17:15:01,再也看不到这种类型的片子。
家庭娱乐,10,2013-12-16 20:55:56,除了完美还是完美
超级天后,7.4,2013-12-11 12:45:01,回归前的澳门社会是有多黑？因果循环，每个人多是权力者的棋子，命运早已注定，质量不错的一部港产黑帮片，缺点是有点粗糙。
觉派,8.6,2013-11-16 18:54:13,比想象中的好很多... ...
电影海报Mtime,8.4,2013-11-7 10:46:07,梁朝伟与刘青云上演兵与匪、斗智斗勇的对决……到底谁能胜出！然而你又希望谁能胜出呢！
邓绿禾,8.0,2013-11-6 8:19:17,這個年輕人啊，是很有本事的。可惜了，兒子，做人哪，有些事情是你想都想不到的。
昆汀是痞子,7.1,2013-10-21 18:39:39,对港产黑帮片不感冒啊。擦擦。
清风徐来,6.0,2013-10-19 21:59:27,不是杜琪峰粉，对这种众人称赞的电影偏偏没感觉。
死都无聊,7.5,2013-10-10 8:09:51,故事一点都不拖沓，就是有的片段少了沉稳、后来看了《以和为贵》那种阴沉，吭哧吭哧，闷声杀人，不吵不闹，反而更加震撼人心。两位影帝都很赞，刘青云更出彩，不浮不躁。编剧费了苦心，营造的宿命感让人心头一击。本来已经认为要走了，要逃了，自由了。峰回路转，死了。
厌恶,7.0,2013-10-6 17:01:27,就像我们这的中心市场
梦1264586,9.0,2013-10-5 13:15:03,银河映像经典之作，百看不厌的佳作
stilldarkness,7.8,2013-9-28 0:53:36,那是相当滴不错！
Luna_星,8.0,2013-9-25 18:27:58,不费力看下来的片子，就是配乐实在折磨，不能说不好，却真的很刺激。 喜欢这样的故事，不含糊够实在。 结尾处与开头的呼应，没有主角光环的宿命感让人唏嘘，所以才让整个片子上了档次呀，真是无力反抗。
-Aegean--,7.0,2013-9-24 20:51:05,悬念够了 谜底欠了点火候。
流星学海,7.0,2013-9-21 15:04:24,一般，没觉得很有意思。
RallF,7.8,2013-9-8 13:36:05,故事和场景就算用于当代也毫不违和，时代感来源于配乐。编剧真心亮点，每个人都被玩弄在股掌间。
王小叶儿,8.4,2013-9-8 11:19:53,每一次都带着缅怀的情绪，每一次都跟着鼓点弦乐打着节拍，每一次都带着会心的微笑。他们走路虎虎生风，他们吃饭暗藏玄机，他们打斗极致寒冷。戒不掉的银河，忘不了的习惯。
bigfly,8.0,2013-8-28 17:32:04,一直对香港警匪片没有抵抗力
万能小剧场,8.0,2013-8-25 17:00:49,没有高清版的片源，所以这些被奉为经典的早期银河映像作品，只能在浑浊的画面中观赏。暗花原来就是赏红的意思，本片画面和剧情都极具油画式的定格感，静静地告诉观者这故事就是这样的。整部影片都充斥着黑暗的宿命味道，一切都已经确定，每个人都无法决定自身未来，这就是所谓的绝望感吧。
大鑫,8.4,2013-8-21 12:53:17,压抑迷离。。还有晃眼的大灯光   主角没发力  邵美琪反倒演的最好
冒牌佐汉,9.0,2013-8-12 18:43:52,你我就像弹球一样，到哪里，什么时候停，自己都不知道。
AlecSun,8.7,2013-8-4 23:03:38,没想到故事性和枪战场景会这么棒，结尾要是再来一个逆转就更加过瘾了。
人生几多颠覆,8.7,2013-7-28 6:33:41,经典，香港经典、有关杜导的究竟那些是看过的，因为没有一系列地看过然后也没有记，真的搞不懂了。。。 这部的确十佳啊。
山鬼先生,8.5,2013-7-24 18:13:40,1.故事被分割成两部分，一部宿命，一部反宿命，梁和刘有力再大的反抗都逃不出被陷害的命运。2.98年的政治寓言，洪先生、基哥、佐治分别代表中港英三方，最后洪先生完胜。3.弹力球、光源对比反差这些反复出现的画面，更渲染了黑暗、荒诞、命理不可违抗的氛围。
嘎嘎青年,8.1,2013-7-3 0:31:46,姜还是老的辣····最后刘青云的死似乎过于简单·····
Page刘,7.1,2013-6-24 10:25:20,早期暗X系列的故事风格，虽然片中掺杂很多其他影片的特色，却走出了自己的味道，含蓄中的佳作~杜琪峰监制。初中时看过觉得很棒，昨天再看力度小了少许。
shelbysu,7.8,2013-6-22 22:54:22,梁朝伟从黑别人到被黑得体无完肤，刘青云也好不到哪去，都是别人手上的棋子，混在江湖，就是老大都岌岌可危
梵蒂冈传教士,7.5,2013-6-10 21:43:26,悲观 阴郁 荒谬
大宝阿扎西,10,2013-6-4 18:34:59,黑色，无尽的黑色
非得三个字,9.3,2013-5-21 19:01:09,很经典  看晚了！
高way,9.0,2013-5-13 11:13:44,这片是真好，各方面都好。要是能把洪先生的形象隐藏处理就完美了，捉弄命运的魔手是无形的嘛。
万年风雪,8.0,2013-5-12 21:25:09,真的很酷！
老韩,9.0,2013-5-12 20:10:48,可以排在《枪火》之后成为我第二喜欢的港片：略带悲剧色彩和无力感的感情基调，引人入胜的故事情节，两大影帝精彩的表演，导演对细节灯光构图剪辑精巧的设计，都让人过目不忘。餐厅和密室两场戏实在精彩，梁朝伟擦汗的手帕和刘青云的弹球确实是香港影史上经典的影像。
黑恼火,9.0,2013-5-7 1:01:59,港片里面绝对的经典
seanpan,7.8,2013-5-4 20:15:21,整部影片充满着黑色和抑郁，完全不同于现今好莱坞式的大团圆结局，也没有任何的个人英雄主义色彩，有的只是小人物的无力挣扎和无谓抵抗。抛开主题，发现从吴宇森的英雄本色开始，香港的黑帮题材电影就一直很善于通过一些小动作来刻画人物。梁朝伟的那个擦汗动作也可以算是影史中的经典画面了。
宇宙无敌大混蛋,8.1,2013-4-28 21:32:21,古龙短篇式的故事，套中套里的人物。
四两白干,9.0,2013-4-22 11:04:33,一环扣一环，伏笔甚多。光影、摄像和影帝演技都可圈可点，暴力场面更是够味，喜欢这种主角明明已经知道自己的结局却无力挣脱的安排，唯一缺憾是影片整体用力过猛了一点。铅笔慢慢伸向眼睛那段的配乐是游戏《青鬼》里青鬼出现时的音乐吗？求这段音乐的出处。
老男孩的夏天,9.0,2013-4-20 22:53:54,经典的港式黑帮片 题材不落俗套 最喜欢这种冷峻有头脑且又凶狠的杀手 要比一千个只会拿刀砍没脑子的侩子手强百倍
